{
  "version": 1,
  "updated_at": "2026-08-08T19:05:00Z",
  "source_agent": "digital-twin",
  "status": "OK",
  "headline": "PAT ports captured for both labs — 10 Prod devices, 12 Dev devices",
  "next_action": "Other agents can read this instead of re-querying CML this session",
  "controller": "cml.presidio.tech",
  "source": "cml_mcp",
  "labs": {
    "prod": {
      "lab_title": "cisco-ai-lab-prod",
      "captured_at": "2026-08-08T19:04:40Z",
      "devices": [
        {
          "hostname": "AI-HQ-EDGE",
          "api_port": 4403,
          "ssh_port": 4402,
          "platform": "iosxe",
          "role": "edge",
          "tags": ["tag:sync", "edge"],
          "state": "BOOTED"
        },
        {
          "hostname": "WAN-01",
          "api_port": 4411,
          "ssh_port": 4410,
          "platform": "iosxe",
          "role": "wan",
          "tags": ["tag:sync", "wan"],
          "state": "BOOTED"
        }
      ]
    },
    "dev": {
      "lab_title": "cisco-ai-lab-dev",
      "captured_at": "2026-08-08T19:04:55Z",
      "devices": [
        {
          "hostname": "AI-BRANCH-01",
          "api_port": 4503,
          "ssh_port": 4502,
          "platform": "iosxe",
          "role": "branch",
          "tags": ["tag:sync", "tag:simulate", "edge"],
          "state": "BOOTED"
        },
        {
          "hostname": "AI-BRANCH-01-SW",
          "api_port": null,
          "ssh_port": null,
          "platform": "iosxe",
          "role": "branch",
          "tags": ["tag:simulate"],
          "state": "BOOTED"
        },
        {
          "hostname": "WAN-04",
          "api_port": 4513,
          "ssh_port": 4512,
          "platform": "iosxe",
          "role": "wan",
          "tags": ["tag:sync", "wan"],
          "state": "BOOTED"
        }
      ]
    }
  }
}
